{
  "meta": {
    "version": 1,
    "profile": "greenfield-example",
    "generatedBy": "ordia init (pip-first stub)"
  },
  "sections": [
    {
      "id": "ordia-cli",
      "title": "Ordia CLI (pip)",
      "notes": [
        "Primary validation: ordia validate --project",
        "Optional npm wrappers can be added to package.json and synced with ordia init --sync-commands"
      ],
      "commands": [
        {
          "name": "ordia:doctor",
          "description": "Check Ordia setup, hooks, and dependencies",
          "command": "ordia doctor"
        },
        {
          "name": "ordia:validate",
          "description": "Validate manifest and control-plane registries",
          "command": "ordia validate --project"
        },
        {
          "name": "ordia:task-summary",
          "description": "Summarize in-flight tasks, active state, and locks",
          "command": "ordia task summary"
        },
        {
          "name": "ordia:prompt-recover",
          "description": "Emit recovery bootstrap prompt block",
          "command": "ordia prompt emit --intent recover"
        }
      ]
    }
  ],
  "quickFlows": [
    {
      "goal": "Bootstrap recovery",
      "command": "ordia prompt emit --intent recover"
    },
    {
      "goal": "Validate control plane",
      "command": "ordia validate --project"
    }
  ],
  "workflowIntents": []
}
